{ "v": 1, "type": "state", "id": "s-2", "re": null, "seq": 2, "ts": 1790000000002, "data": { "live": true, "user": { "name": "Ada" }, "agent": { "running": false, "task": null }, "sandbox": null, "gameMode": false, "system": { "host": "turingos", "cpu": 18, "mem": 42, "battery": { "level": 82, "charging": false }, "wifi": { "ssid": "Studio" }, "installer": false }, "weather": null, "github": null, "calendar": { "connected": false, "nextEvent": null } } }
